"ASIN","title","order","category","brand","price","global_rating_count","description","Special_Feature","total_star_mean","detail_dict","best_sellers_rank_Feature","Ingredients","is_bundle"
B0D9WNHL3Q,"PURITO Cica Clearing BB Cream #13 Neutral Ivory + #21 Light Beige (1 fl.oz / 30ml) Vegan bb cream, foundation, cruelty free",6,Makeup,No brand,,"2","{""description"": ""Vegan & Cruelty-free\nGlow & Natural-Coverage\nEO & Artificial Fragrance-free\nDay Care""}",No special feature,5.0,"{""ASIN"": ""B0D9WNHL3Q""}",No result,,0
B0D9WPLG1S,"PURITO Cica Clearing BB Cream #13 Neutral Ivory + #15 Rose Ivory (1 fl.oz / 30ml) Vegan bb cream, foundation, cruelty free",7,Makeup,No brand,,"1","{""description"": ""Vegan & Cruelty-free\nGlow & Natural-Coverage\nEO & Artificial Fragrance-free\nDay Care""}",No special feature,5.0,"{""ASIN"": ""B0D9WPLG1S""}",No result,,0
B0DCYJY651,"PURITO Mighty Bamboo Panthenol Cleanser, Gentle Face Wash for Moisturizing, for Sensitive Skin, Vegan & Cruelty-Free Face Cleanser150ml / 5.07 fl. Oz.",7,Skin Care Products,PURITO,15.0,"115","{""description"": ""[Gentle Low pH Formula for Barrier Protection] - Because the skin barrier deserves gentle care, this low pH cleanser helps balance your skin's pH to support a healthy barrier, reducing the risk of moisture loss and sensitivity.\n[Post-Cleanse Hydration Boost] - Clinically proven to increase hydration levels post-cleansing, this cleanser ensures your skin stays hydrated without causing tightness or stripping.\n[Bamboo Extract Resembling Body Moisture] - Korean Bamboo Extract, with a composition similar to that of the human body, penetrates deeply to enhance the skin's moisture barrier, promoting strong and resilient skin.\n[Day & Night Cleanser] - Equally gentle and strong, delivering a pleasant morning refresh and an effective nighttime cleanse that removes sunscreen and stubborn impurities.\n[Made for Sensitive Skin] - This cleanser with its unique gel formula ensures a gentle yet effective cleanse, tested to be hypoallergenic and suitable for sensitive skin.""}",No special feature,4.7,"{""ASIN"": ""B0DCYJY651"", ""Manufacturer"": ""HINATURE Inc"", ""Country of Origin"": ""Korea, Republic of"", ""Product Dimensions"": ""1.38 x 1.38 x 2.76 inches; 6.7 ounces""}","#58,563 in Beauty & Personal Care (See Top 100 in Beauty & Personal Care)
#839 in Facial Cleansing Washes",,0
B0DHTZV81L,PURITO Centella Unscented Serum & Mighty Bamboo Panthenol Cream Glow Duo Glass Skin Duo Set,8,Skin Care Products,PURITO,,"3","{""description"": ""Rich moisturizing cream formulated with 10% Panthenol helps protect and strengthen the skin barrier. Panthenol provides instant hydration, attracts and holds moisture to retain it within the skin layers.\n[✨#1 MOST REPURCHASED HOLY GRAIL SERUM✨] - The ultimate sensitive-skin savior, this serum is a must-have for those seeking irritation and redness relief.\nPanthenol also called pro-vitamin B5 is both an emollient and humectant with exceptional moisturizing benefits. It helps strengthen the skin barrier and serves as a protection against environmental stressors. This is a high-performance ingredient that soothes the skin, providing instant relief to redness and irritation.\n[⏱️10-SECOND RAPID SOOTHING⏱️] - Clinically proven to instantly calm the skin, this serum delivers quick relief from irritation and redness after just one application.""}",No special feature,5.0,"{""ASIN"": ""B0DHTZV81L""}",No result,,0
B0DHV38KHH,PURITO Oat-in Calming Gel Cream Mighty Bamboo Panthenol Cream Glass Skin Duo Set,33,Skin Care Products,PURITO,,No rating,"{""description"": ""[THE PERFECT CREAM BUNDLE SET] - The combination of Oat-in Calming Gel Cream which instantly calms dry and sensitive skin, and the Mighty Bamboo Panthenol Cream which helps protect and strengthen the skin barrier, makes the synergy stronger to your skin\n[KEEP YOUR SKIN BALANCED AND VIBRANT] - The combination of oat and panthenol provides a refreshing splash of hydration and additional nutrients while creating a protective barrier\n[INFUSED WITH ONLY NATURAL INGREDIENTS] - Both products are made with gentle ingredients, such as Avena Sative (Oat) Seed Water, Niacinamide, and Centella Asiatica Extract, which make them completely safe to use\n[INSTANTLY IMPROVES THE SKIN'S MOISTURE BARRIER] - Rich in antioxidants and hydrating properities, this cream set is for all skin types, particularly suitable for sensitive skin""}",No special feature,,"{""ASIN"": ""B0DHV38KHH""}",No result,,0
B0DHV38R27,PURITO Centella Unscented Serum & PURITO Oat-in Calming Gel Cream100 ml Set,5,Skin Care Products,PURITO,,No rating,"{""description"": ""[✨#1 MOST REPURCHASED HOLY GRAIL SERUM✨] - The ultimate sensitive-skin savior, this serum is a must-have for those seeking irritation and redness relief.\nAvena Sativa (Oat) Seed Water(77%) is a gentle ingredient that calms irritated skin. Rich in antioxidants and hydrating properties, this ingredient instantly improves the skin's moisture barrier. It is particularly suitable for sensitive skin.""}",No special feature,,"{""ASIN"": ""B0DHV38R27""}",No result,,0
B0DHV41VSL,PURITO Oat-in Calming Gel Cream 100 ml & PURITO SEOUL Timeless Bloom Retinol Spot Cream Set,7,Skin Care Products,PURITO,,No rating,"{""description"": ""Avena Sativa (Oat) Seed Water(77%) is a gentle ingredient that calms irritated skin. Rich in antioxidants and hydrating properties, this ingredient instantly improves the skin's moisture barrier. It is particularly suitable for sensitive skin.\n[💪🏻 POWERFUL WRINKLE REDUCTION 💪🏻] A gentle, yet powerful wrinkle erasing spot cream with a creamy texture, made for first-time retinol users.""}",No special feature,,"{""ASIN"": ""B0DHV41VSL""}",No result,,0
B0DHV6GN76,PURITO Oat-in Calming Gel Cream 100 ml Deep Sea Cream Set,2,Skin Care Products,No brand,,"1","{""description"": ""Avena Sativa (Oat) Seed Water(77%) is a gentle ingredient that calms irritated skin. Rich in antioxidants and hydrating properties, this ingredient instantly improves the skin's moisture barrier. It is particularly suitable for sensitive skin.\n[💧MOISTURE LOCKING HYDRA-SEAL CREAM💧] Satin-like gel cream creates a barrier and seals in moisture to maintain long-lasting hydration for supple skin.""}",No special feature,5.0,"{""ASIN"": ""B0DHV6GN76""}",No result,,0
B0DK32WJZY,"PURITO Luminous Moisture Shea Butter Body Lotion, Shea Butter, Gentle on Skin, Moisturizing, Dry Skin, Pump Bottle, K-Beauty, 300ml / 10.14 fl. oz. (Midnight Romance, 10.14 fl. oz.)",28,Skin Care Products,PURITO,25.0,"188","{""description"": ""[Signature Korea Scents] - Smell and feel good with 3 uplifting scents that transport/take you to Korea’s charming urban, coastal, and traditional scenes.\n[Scents Safe for All] - Crafted with *no fragrance allergens(as of august 2024) and clinically proven to be irritation-free to ensure all skin types can safely enjoy the scented experience.\n[Comforting Velvety Texture] - The soft, non-greasy texture absorbs quickly and moisturizes thoroughly, leaving the skin with a residue-free, silky smooth feel.\n[Dry Skin Solution] - Shea butter, a super food for the skin, combined with the vitality of Jeju Starflower, provides long-lasting, deep moisture for supple skin.""}",No special feature,4.6,"{""ASIN"": ""B0DK32WJZY"", ""Manufacturer"": ""HINATURE Inc."", ""Country of Origin"": ""Korea, Republic of"", ""Product Dimensions"": ""2.48 x 2.48 x 6.1 inches; 13.05 ounces""}","#174,869 in Beauty & Personal Care (See Top 100 in Beauty & Personal Care)
#2,612 in Body Lotions",,0
B0DKHD1BS7,"PURITO SEOUL Best Kit - Skincare Routine with Panthenol Cleanser & Cream, Unscented Centella Serum & Toner, For All Skin Types, Gift Set, For Face, Facial Serum, K-Beauty, 3.52 fl. oz.",9,Skin Care Products,PURITO,23.0,"57","{""description"": ""[🌟PURITO SEOUL BEST KIT🌟] - A compact and convenient kit for a full skincare routine.\n[🍀CLEANSERS TO FACIAL CREAM🍀] - Complete with a cleanser, toner, serum and cream, you can take care of your skin from A to Z with this single kit.\n[🎍 SKIN-FRIENDLY INGREDIENTS] - Korean Centella-infused products soothe your skin while the Korean Bamboo formulas strengthen the moisture barrier.\n[✨ CUTE AND MINI SIZE ✨] - Five mini versions of Purito Seoul’s bestsellers, small enough to take these little skincare buddies with you wherever you go!\n[✔️MADE FOR ALL SKIN TYPES✔️] - Feel the difference every time using our Best Kit. Gift your skin rapid soothing and a radiant glow.""}",No special feature,4.5,"{""ASIN"": ""B0DKHD1BS7"", ""Manufacturer"": ""HINATURE Inc."", ""Country of Origin"": ""Korea, Republic of"", ""Package Dimensions"": ""5.31 x 4.13 x 1.26 inches; 6.38 ounces""}","#26,851 in Beauty & Personal Care (See Top 100 in Beauty & Personal Care)
#48 in Skin Care Sets & Kits",,0
B0DMVYYQV2,"PURITO Centella Unscented Toner, Unscented Serum, Mighty Bamboo Panthenol Cream Set",34,Skin Care Products,PURITO,,No rating,"{""description"": ""[⏱️10-SECOND RAPID SOOTHING⏱️] - Gently crafted for sensitive skin, this rapid-soothing toner delivers quick relief from irritation and redness after just one application.\n[✨#1 MOST REPURCHASED HOLY GRAIL SERUM✨] - The ultimate sensitive-skin savior, this serum is a must-have for those seeking irritation and redness relief.\nRich moisturizing cream formulated with 10% Panthenol helps protect and strengthen the skin barrier. Panthenol provides instant hydration, attracts and holds moisture to retain it within the skin layers. Combined with skin-friendly ingredients such as Niacinamide, Squalane, and Centella Asiatica Extract, this cream offers exceptional performance in softening the skin, leaving it smooth, and providing continuous improvements to skin's health.\n[🍀INFUSED WITH CALMING KOREAN CENTELLA🍀] - Korean Centella Asiatica, an ancient Korean herb, is a renowned soothing wonder. Having to survive the harsh conditions of Korea’s four seasons and diverse terrains, it possesses stronger soothing properties, effectively relieving skin redness and discomfort.""}",No special feature,,"{""ASIN"": ""B0DMVYYQV2"", ""Manufacturer"": ""PURITO""}",No result,,0
B0DMVZC6BD,"PURITO Mighty Bamboo Panthenol Cleanser, Centella Unscented Serum & Oat-in Calming Gel Cream Set",35,Skin Care Products,PURITO,,No rating,"{""description"": ""[Gentle Low pH Formula for Barrier Protection] - Because the skin barrier deserves gentle care, this low pH cleanser helps balance your skin's pH to support a healthy barrier, reducing the risk of moisture loss and sensitivity.\n[✨#1 MOST REPURCHASED HOLY GRAIL SERUM✨] - The ultimate sensitive-skin savior, this serum is a must-have for those seeking irritation and redness relief.\nRefreshing gel cream with nourishing Avena Sativa (Oat) Seed Water instantly calms dry and sensitive skin. The lightweight clear texture softly melts on the skin, easily seeping into its layers. This gel cream improves skin's moisture level, and soothes hypersensitivity, keeping the skin balanced and vibrant. The combination of oat and panthenol provides a refreshing splash of hydration and additional nutrients while creating a protective barrier.""}",No special feature,,"{""ASIN"": ""B0DMVZC6BD""}",No result,,0
B0DMVZTVH1,"PURITO From Green Cleansing Oil, Centella Unscented Serum & Mighty Bamboo Panthenol Cream Set",4,Skin Care Products,PURITO,,No rating,"{""description"": ""[⭐️SHOW OFF YOUR BRIGHT AND FRESH SKIN⭐️] - This hypoallergenic cleansing oil uses only essential ingredients to prevent the skin from drying out, and it moisturizes your skin to reveal a radiant and soft complexion. Remove makeup, sunscreens, dust, and other waste products with this deep, soft cleansing oil.\n[✨#1 MOST REPURCHASED HOLY GRAIL SERUM✨] - The ultimate sensitive-skin savior, this serum is a must-have for those seeking irritation and redness relief.\nRich moisturizing cream formulated with 10% Panthenol helps protect and strengthen the skin barrier. Panthenol provides instant hydration, attracts and holds moisture to retain it within the skin layers. Combined with skin-friendly ingredients such as Niacinamide, Squalane, and Centella Asiatica Extract, this cream offers exceptional performance in softening the skin, leaving it smooth, and providing continuous improvements to skin's health.""}",No special feature,,"{""ASIN"": ""B0DMVZTVH1""}",No result,,0
B0DNM9M7QJ,Purito Seoul Perfect Routine Set for Glass skin (Panthenol Cleanser + Centella Unscented Toner + Serum + Panthenol Cream),6,Skin Care Products,PURITO,,"1","{""description"": ""[Gentle Low pH Formula for Barrier Protection] - Because the skin barrier deserves gentle care, this low pH cleanser helps balance your skin's pH to support a healthy barrier, reducing the risk of moisture loss and sensitivity.\n[⏱️10-SECOND RAPID SOOTHING⏱️] - Gently crafted for sensitive skin, this rapid-soothing toner delivers quick relief from irritation and redness after just one application.\n[✨#1 MOST REPURCHASED HOLY GRAIL SERUM✨] - The ultimate sensitive-skin savior, this serum is a must-have for those seeking irritation and redness relief.\nRich moisturizing cream formulated with 10% Panthenol helps protect and strengthen the skin barrier. Panthenol provides instant hydration, attracts and holds moisture to retain it within the skin layers. Combined with skin-friendly ingredients such as Niacinamide, Squalane, and Centella Asiatica Extract, this cream offers exceptional performance in softening the skin, leaving it smooth, and providing continuous improvements to skin's health.""}",No special feature,5.0,"{""ASIN"": ""B0DNM9M7QJ"", ""Manufacturer"": ""PURITO""}",No result,"Gently cleanse face with Panthenol Cleanser, then apply Centella Unscented Toner. Follow with the Serum for irritation and redness relief. Finish with Panthenol Cream, combined with skin-friendly ingredients, for moisturizing. Use daily for best results.",0
B0DNM9Y7H9,"Purito Seoul BEST SELLER SET FOR GLASS SKIN (Centella Unscented Serum + Mighty Bamboo Panthenol Cream + Oat-in Calming Gel Cream), Moisturizer, Vegan & Cruelty-Free, Kore",3,Skin Care Products,PURITO,,No rating,"{""description"": ""[✨#1 MOST REPURCHASED HOLY GRAIL SERUM✨] - The ultimate sensitive-skin savior, this serum is a must-have for those seeking irritation and redness relief.\nRich moisturizing cream formulated with 10% Panthenol helps protect and strengthen the skin barrier. Panthenol provides instant hydration, attracts and holds moisture to retain it within the skin layers. Combined with skin-friendly ingredients such as Niacinamide, Squalane, and Centella Asiatica Extract, this cream offers exceptional performance in softening the skin, leaving it smooth, and providing continuous improvements to skin's health.\nRefreshing gel cream with nourishing Avena Sativa (Oat) Seed Water instantly calms dry and sensitive skin. The lightweight clear texture softly melts on the skin, easily seeping into its layers. This gel cream improves skin's moisture level, and soothes hypersensitivity, keeping the skin balanced and vibrant. The combination of oat and panthenol provides a refreshing splash of hydration and additional nutrients while creating a protective barrier.\n[⏱️10-SECOND RAPID SOOTHING⏱️] - Clinically proven to instantly calm the skin, this serum delivers quick relief from irritation and redness after just one application.""}",No special feature,,"{""ASIN"": ""B0DNM9Y7H9""}",No result,,0
B0DQ3BQ8YC,"PURITO Mighty Bamboo Panthenol Serum, Glow Serum, Moisture Barrier Repair, for All Skin Types, Fast Absorbing, Deep Hydration, Glass Skin, Vegan & Cruelty-Free, Korean Skincare 1.01 fl.oz / 30 mL",24,Skin Care Products,PURITO,22.0,No rating,"{""description"": ""[ 13% Panthenol for Deep Hydration ] High concentration of Panthenol (Vitamin B5) acts as a hydration building block, attracting and retaining deep moisture within the skin layers. It soothes irritation and enhances skin resilience against daily environmental stressors, leaving it soft and nourished.\n[ Glowing Radiance with Damyang Bamboo ] Rich in essential amino acids, Korean Damyang Bamboo Extract deeply hydrates and enhances moisture retention, helping to keep your skin plump, glowing, and radiant. This K-beauty ingredient works to mimic the body’s natural moisture balance for a luminous finish.\n[ Gentle and Safe for All Skin Types ] Dermatologist-tested and hypoallergenic, this serum is free of artificial fragrances and essential oils, making it ideal for all skin types including the sensitive skin.\n[ Vegan & Clean Beauty Formula ] Lightweight, fast-absorbing serum leaves your skin feeling refreshed and hydrated without a sticky residue. Made with plant-based, cruelty-free ingredients, it’s perfect for your clean and conscious skincare routine while providing glowing results.\n[ Complete Your Moisturizing Routine ] Begin with our Panthenol Cleanser to gently cleanse, follow with the Panthenol Serum to deeply hydrate, and finish with the Panthenol Cream to lock in moisture—your complete skincare routine for smooth, refreshed, and radiant skin.""}",No special feature,,"{""ASIN"": ""B0DQ3BQ8YC"", ""Manufacturer"": ""HINATURE Inc"", ""Country of Origin"": ""Korea, Republic of"", ""Package Dimensions"": ""3.82 x 1.57 x 1.57 inches; 3.21 ounces""}","#135,121 in Beauty & Personal Care (See Top 100 in Beauty & Personal Care)
#2,647 in Facial Serums",,0
